{
  "schema_version": 1,
  "idempotency_key": "22222222-2222-4222-8222-222222222222",
  "operation_id": "33333333-3333-4333-8333-333333333333",
  "actor_id": "44444444-4444-4444-8444-444444444444",
  "source_revision": 3,
  "ingestion_generation": 7,
  "media_operation_id": "55555555-5555-4555-8555-555555555555",
  "media_generation": 2,
  "chapter_id": null,
  "expected_revision": 0,
  "chapter_number": "12.50",
  "title": "\u5929\u72d0 \u2014 Caf\u00e9 \ud83d\ude80 <>&\u2028next",
  "manifest": {
    "schema_version": 1,
    "series_id": "11111111-1111-4111-8111-111111111111",
    "series_slug": "fixture-series",
    "chapter_slug": "chapter-12-5",
    "pages": [
      {
        "page_number": 1,
        "image_path": "fixture-series/chapter-12-5/_v4/fd41034df3d3052913b4/0001.mrt",
        "width": 1080,
        "height": 1600,
        "size_bytes": 180000,
        "sha256": "abababababababababababababababababababababababababababababababab",
        "encoding_version": 4,
        "encoding_rows": 4,
        "encoding_columns": 4,
        "encoding_seed": "0123456789abcdef0123456789abcdef",
        "responsive": {
          "image_path": "fixture-series/chapter-12-5/_v4/fd41034df3d3052913b4/w720/0001.mrt",
          "width": 720,
          "height": 1067,
          "size_bytes": 92000,
          "sha256": "cdcdcdcdcdcdcdcdcdcdcdcdcdcdcdcdcdcdcdcdcdcdcdcdcdcdcdcdcdcdcdcd"
        }
      }
    ]
  },
  "payload_sha256": "4a4de87cbc6e05845d033616a757bdf88bf83613dd901d711e95d5bcdf643488"
}
